"Pesquisador_Responsável","Pesquisadores_Associados","Pesquisadores_Principais","Cidade","Instituições_no_Exterior","Área_do_Conhecimento","Data_de_Início","Data_de_Término"
"Eduardo Carità","Fabiana Regina Nonato - Guilherme Gigliotti Leoneli","Maria Isabel Ribeiro Lopez de Heredia, Mariana Alejandra Echalar Barrientos","Valinhos","","Engenharia Biomédica","7/1/2020","6/30/2023"
"Jose Rodolfo Pfaffmann Fiori","Guilherme Botelho Diniz Junqueira","Ricardo de Oliveira e Pereira Ramos","São Paulo","","Ciência da Computação","7/1/2020","12/31/2021"
"Robson Luis Ferraz do Amaral","Fernanda Maris Peria - Kamilla Swiech Antonietto","","Ribeirão Preto","","Farmácia","7/1/2020","6/30/2021"
"Mauro Angelo Alves","Alexandre Lyra Alves - Rogerio Acioli Lopes Alves","","São José dos Campos","","Engenharia Elétrica","7/1/2020","5/31/2021"
"Leandro Carneiro Barbosa","","","Campinas","","Agronomia","7/1/2020","3/31/2021"
"Matheus Suenson Cardoso","Gustavo Gimenez Parra - Lucas de Biasi Cabral dos Santos - Lúcia Akemi Miyazato Saito - Rodrigo Mendes Gerosa","","São Paulo","","Engenharia Mecânica","7/1/2020","6/30/2022"
"Tatiani Falvo Almeida","","","São Carlos","","Engenharia de Materiais e Metalúrgica","7/1/2020","6/30/2021"
"Jan Carlo Morais Oliveira Bertassoni Delorenzi","Manuel Salustiano Almeida Saavedra","","São Paulo","","Parasitologia","7/1/2020","6/30/2022"
"Pilar Drummond Sampaio Corrêa Mariani","Horacio Montenegro","","Piracicaba","","Genética","7/1/2020","2/28/2023"
"Rafael Antonio da Silva Rosa","","","São José dos Campos","","Recursos Florestais e Engenharia Florestal","7/1/2020","6/30/2022"
"Leonardo Dias Cagnani","","","São Carlos","","Engenharia Elétrica","7/1/2020","3/31/2021"
"Guilherme Maerschner Ogawa","","Anakele Massi Monteiro, Raquel Veturiano Barroso Orbolato","São José dos Campos","","Medicina","7/1/2020","3/31/2021"
"Naiara Utimura Torres","Fernanda Cristina Costa","","São Carlos","","Saúde Coletiva","7/1/2020","6/30/2022"
"Martha Sahylí Ortega Pijeira","Emerson Soares Bernardes - Marcelo Dias Baruffi - Sofia Nascimento dos Santos","","São Paulo","","Engenharia Nuclear","7/1/2020","3/31/2021"
"Marcelo Antonio Donizetti Martinho","Tiago de Góes Conti","","São Carlos","","","6/1/2020","2/28/2021"
"Fernando Garcia Nicodemos","","","São José dos Campos","","Engenharia Elétrica","6/1/2020","5/31/2022"
"Ana Paula de Lacerda Zacharias","","Christiane Bacci Reghine, Marco Aurelio Amaral Henriques","Campinas","","","6/1/2020","9/30/2022"
"André May","","","Paulínia","","Agronomia","6/1/2020","5/31/2022"
"Sheyla Cristina Vargas Baldi","Elisabete Maria Macedo Viegas","","São Paulo","","Recursos Pesqueiros e Engenharia de Pesca","6/1/2020","11/30/2022"
"Marcos Nascimbem Ferraz","João Felipe Manfrinato Mariano - Rodrigo Gonçalves Trevisan","","Piracicaba","","Agronomia","6/1/2020","6/30/2021"
"Luiz Henrique Cherri","","","São Carlos","","Engenharia de Produção","6/1/2020","4/30/2021"
"Geraldo Gullo","Carlos Augusto Ribeiro - Glauco Guaitoli","Mateus Henrique Platti Barboza","Sertãozinho","","Engenharia Elétrica","6/1/2020","2/28/2021"
"Victor Hochgreb de Freitas","","Julio Cesar dos Reis","Santo André","","Ciência da Computação","6/1/2020","2/28/2021"
"Ingrid Gielow","Diana Melissa Faria","","Sorocaba","","","6/1/2020","11/30/2022"
"Cesar Augusto Mayor Herrera","","Paulo Rogerio Ferreira","São José dos Campos","","","6/1/2020","3/31/2021"
"Adauton Machado Heringer","Flávio Soares Corrêa da Silva","João Phellip de Mello Bones da Rocha","São Paulo","","Ciência da Computação","6/1/2020","5/31/2022"
"Larissa Galante Elias","Cristiano Menezes - David de Jong - Filipe Jose Dal Bo de Andrade - Gabriel Moura Mascarin - Lucas Garcia von Zuben","Bárbara Matos Do Prado, Túlio Marcos Nunes","Ribeirão Preto","","Ecologia","6/1/2020","5/31/2022"
"Mariza Monteiro","Carlos Augusto Colombo - Cesar Augusto Zanello - Luciano Delmondes de Alencar - Maria Imaculada Zucchi","","Piracicaba","","Agronomia","6/1/2020","5/31/2021"
"Rafael Holzhacker","Luiz Henrique de Moura Teixeira Balloti - Taciana Tonetto Castelo Branco Trigo","","São Paulo","","Engenharia Biomédica","5/1/2020","6/30/2021"
"Cesar Celeste Ghizoni","","","São José dos Campos","","Engenharia Química","5/1/2020","6/30/2021"
"Fernando José Vieira da Silva","","","Sorocaba","","Ciência da Computação","5/1/2020","3/31/2021"
"Alexandre Picchi Neves","","Francisco de Assis Magalhães Gomes Neto","Indaiatuba","","Matemática","5/1/2020","4/30/2021"
"Mateus Tonini Eitelwein","Fernando Dill Hinnah - Jayme Garcia Arnal Barbedo - João Felipe Manfrinato Mariano","","Piracicaba","","Agronomia","5/1/2020","5/31/2021"
"Cíntia Carla Melgaço de Oliveira","Vivaldo Silveira Junior","","Campinas","","Ciência e Tecnologia de Alimentos","5/1/2020","1/31/2021"
"Cesar Celeste Ghizoni","","","São José dos Campos","","Engenharia Química","5/1/2020","6/30/2021"
"Lara Endres da Silva","Alexandre Wagner Silva Hilsdorf - Renata Alonso Miotto","","Amparo","","Ecologia","5/1/2020","6/30/2021"
"Raphael Pereira Moreno","","","São Carlos","","","5/1/2020","10/31/2021"
"William Robert Heinrich","Abel Fernando Alves de Souza - Andréia da Silva Borges - Carlos Augusto de Sousa Filho - Danilo Silva de Oliveira - Enrique de Paula - Gerson Pizzirani Murari - Giovanna Rocha Costa - Giuliano Bettiol - Guilherme Jovanini Montagner - Heitor Gomes de Oliveira - João Paulo Coelho Leite - Mateus Quitério José Marques - Rafael Giareta Falcaro - Ricardo Henrique Leoni","","Campinas","","Engenharia Biomédica","5/1/2020","11/30/2020"
"Poliana Moser","Vânia Regina Nicoletti Telis","","Votuporanga","","Ciência e Tecnologia de Alimentos","5/1/2020","1/31/2021"
"Jose Gonçalves Franco Junior","Adriana Renzi - Ana Lúcia Mauri - Joao Batista Alcantara Oliveira","Antonio Hélio Oliani, Laura Diniz Vagnini Alavarse","Ribeirão Preto","","Medicina","4/1/2020","12/31/2020"
"Mateus Modesto","Alan Caio Rodrigues Marques - Fabiano Rodrigues da Cunha Araújo - Tiago Zanett Albertini - Yuri Baldini Farjalla","Roberto Daniel Sainz Gonzalez","Piracicaba","","Zootecnia","4/1/2020","4/30/2021"
"Everton Alvares Cherman","Bruno Magalhães Nogueira - Diego Furtado Silva - Moacir Antonelli Ponti - Rafael Geraldeli Rossi - Solange Oliveira Rezende","Ricardo Marcondes Marcacini","São Paulo","","Ciência da Computação","4/1/2020","3/31/2021"
"Alessandro Silveira Davi","Alejandro Arturo Rios Cruz - Clécio Fischer - Leonardo Murilo Nepomuceno","Ricardo Galdino da Silva","São José dos Campos","","Engenharia Aeroespacial","4/1/2020","6/30/2021"
"Artur Rodrigues Teixeira","André Luiz Jardini Munhoz","","Campinas","","Engenharia Mecânica","4/1/2020","4/30/2021"
"José Roberto Tibúrcio Gonçalves","","","Votuporanga","","","4/1/2020","3/31/2022"
"Rodrigo Fernandes Vernini","","","São Carlos","","Engenharia Elétrica","4/1/2020","9/30/2022"
"Fabio Miranda","Suzilene Real Janasi","Daniel Rodrigues","Cajamar","","Engenharia de Materiais e Metalúrgica","4/1/2020","12/31/2021"
"Adolfo Nicolas Posadas Durand","","","São Carlos","","Agronomia","4/1/2020","9/30/2022"
"André Luiz Gonçalves Loureiro de Souza","","","Santa Bárbara D'Oeste","","Engenharia Elétrica","4/1/2020","12/31/2020"
"Paulo Fernando Tóro","André Torre Neto","","Barretos","","Agronomia","3/1/2020","5/31/2022"
"Nicolas Goulart Silva","","Vitor Augusto Silva Bueno","Vinhedo","","Engenharia Elétrica","3/1/2020","10/31/2020"
"Erika da Silva Carvalho Morani","Ana Cláudia Silva Braga - Edson Crusca Junior - Karine Minari - Renata Prandini Adum de Matos","Marcelo Roncoletta","Jaboticabal","","","3/1/2020","2/28/2022"
"Emerson Leite","","","Taubaté","","Química","3/1/2020","5/31/2021"
"Simone Cristina Picchi","Alessandra Alves de Souza - Helvecio Della Coletta Filho - Marcos Antonio Machado","Francisco Humberto Henrique","Araras","","Agronomia","3/1/2020","2/28/2023"
"Adriana Ferreira Lopes Vilela","Juliana Maria de Lima","","Ribeirão Preto","","Química","3/1/2020","11/30/2020"
"Aureliano Agostinho Dias Meirelles","Juliane Viganó","","Campinas","","Ciência e Tecnologia de Alimentos","3/1/2020","3/31/2021"
"Roberto de Alencar Lotufo","Rodrigo Frassetto Nogueira - Rubens Campos Machado","","Campinas","","Ciência da Computação","3/1/2020","4/30/2022"
"Tácito Mistrorigo de Almeida","Andrea Fonseca da Cruz - Geraldo Lorenzi Filho","","São Paulo","","Medicina","3/1/2020","2/28/2021"
"Pedro Henrique Camargo Penna","Claudio Miguel da Costa Neto","","São Caetano do Sul","","Farmacologia","3/1/2020","5/31/2021"
"Raul Julian Revelo Tobar","","","São Carlos","","","3/1/2020","11/30/2020"
"Marcelo Romano Teixeira","Carlos Cesar Aparecido Eguti - Thiago de Araújo Mastrangelo","","Piracicaba","","Agronomia","3/1/2020","2/28/2021"
"Ana Luíza Garcia Millás Massaguer","Marcelo Henrique Napimoga - Sonja Ellen Lobo","Pedro Xavier Rodriguez Massaguer","Campinas","","","3/1/2020","10/31/2022"
"Renata Cristiano Nome","Anderson Vedoveto Martins - Andre Correa Marcilio - Renan Nacco Galindo Serrano","","Americana","","Engenharia Elétrica","3/1/2020","2/28/2022"
"Luiz Eduardo de Melo Mafra Machado","","","Amparo","","Medicina Veterinária","3/1/2020","6/30/2021"
"Ranieri Silvestre de Barros","Beatriz de Araujo Antonio - Conrado Leite de Vitor - Lígia Galvão de Abreu Corso","","Suzano","","Engenharia Mecânica","3/1/2020","3/31/2021"
"Larissa Camerlengo Dias Gomes","","","Araraquara","","Fisioterapia e Terapia Ocupacional","3/1/2020","10/31/2022"
"Hugo Rafacho Fernandes","","","Campinas","","Agronomia","3/1/2020","2/28/2021"
"Pedro Henrique de Oliveira Colombo","","","São Paulo","","Engenharia Biomédica","3/1/2020","1/31/2021"
"Saint Clair Henrique Nunes","","Arthur Roza Augusto, Pedro Campos Assunção","São José dos Campos","","Engenharia Elétrica","3/1/2020","8/31/2022"
"Lincoln Miziara Barboza Ferreira","","","Araraquara","","Ciência da Computação","2/1/2020","1/31/2021"
"Afonso Celso Medina","André Bergsten Mendes","","São Paulo","","Engenharia de Produção","2/1/2020","10/31/2020"
"Daiana Bampi","Erica Hayashi - Jorge Alberto Marques Rezende - Pedro Hayashi","","Vargem Grande do Sul","","Agronomia","2/1/2020","10/31/2020"
"Gabriela Byzynski Soares","Cauê Ribeiro de Oliveira - Filippo Ghiglieno","","São José do Rio Preto","","","2/1/2020","1/31/2022"
"Ana Paula Justiniano Régo","Graziela Cristina Rossi Moura Andrade - Marta Siviero Guilherme Pires - Valdemar Luiz Tornisielo - Vanessa Takeshita","","Piracicaba","","Microbiologia","2/1/2020","10/31/2020"
"Carla de Freitas Munhoz","Amanda Cristina Marabesi - Solange Guidolin Canniatti Brazaca","","Piracicaba","","Ciência e Tecnologia de Alimentos","2/1/2020","1/31/2021"
"Paulo Gurgel Pinheiro","","","Campinas","","Engenharia Elétrica","2/1/2020","10/31/2020"
"Camila de Almeida Melo","","","São José do Rio Preto","","Química","2/1/2020","12/31/2020"
"Milton Felicissimo","Ana Paula Lemes","Dilson Sadanobu Tsurumaki","São José dos Campos","","Engenharia de Produção","2/1/2020","5/31/2022"
"Maria Aparecida Ferreira de Almeida","GUIDO TIRONE","Lucila Maria Lopes de Carvalho","Pirassununga","","Parasitologia","2/1/2020","1/31/2021"
"Paula Cristiane Machado","Paulo Henrique Marques de Andrade - Paulo Teixeira Lacava","","Barretos","","Agronomia","2/1/2020","10/31/2020"
"Luis Gustavo Rocha Vianna","Marco Antonio Gutierrez - Ricardo Di Lazzaro Filho - Suzane Kioko Ono","","São Paulo","","Medicina","2/1/2020","4/30/2022"
"Valdionei Giassi","","","Ipeúna","","Agronomia","2/1/2020","7/31/2022"
"Andreas Kaasi","André Luiz Jardini Munhoz - Cecilia Amelia de Carvalho Zavaglia - Eliana Aparecida de Rezende Duek - Paulo Kharmandayan - Rubens Maciel Filho","","São Paulo","","","2/1/2020","1/31/2024"
"Bruna Nunes Marsiglio Sarout","Alan Caio Rodrigues Marques - Thiago Sérgio de Andrade","","Manaus","","Zootecnia","2/1/2020","1/31/2021"
"Bruna Tatsue Grichoswski Nakagawa","Fabio Trigo Raya - Robson Tramontina","","Santo André","","Bioquímica","2/1/2020","12/31/2020"
"José Álvaro Ogando","","Felipe Iwagaki Braga Ogando","Paulínia","","Ciência e Tecnologia de Alimentos","2/1/2020","10/31/2020"
"Viviani Akemi Kasahara","","Leandro Nunes de Castro Silva","São Paulo","","Ciência da Computação","2/1/2020","7/31/2021"
"Alberto Bueno Júnior","","","São Paulo","","Ciência da Computação","2/1/2020","1/31/2022"
"Tony Rogério de Lima Dadamos","","","São José do Rio Preto","","Engenharia Sanitária","12/1/2019","8/31/2020"
"Diogo Gará Caetano","","Guilherme Jorge Gomes de Sousa, José Sindi Yamamoto, Thiago Gará Caetano","Campinas","","Engenharia Elétrica","12/1/2019","5/31/2022"
"Rafael Nunes da Silva","Bruno Utiyama da Silva - Eduardo Guy Perpétuo Bock - Mariana Maria Aparecida Pinto Hernandes - Tarcísio Fernandes Leão","Bruno Jesus dos Santos, Gustavo Caravita de Andrade","São Bernardo do Campo","","Engenharia Biomédica","12/1/2019","11/30/2021"
"José Leonardo Camargo de Campos","Efraim Albrecht Neto","Eduardo Antonio Boscardin Pita, Felipe Martins Silva, Rafael de Souza Favalli","Campinas","","Engenharia Agrícola","12/1/2019","5/31/2022"
"Mariana Aparecida Brunini Rosales","","Franco Aparecido Rossato","Campinas","","Medicina","12/1/2019","11/30/2020"
"César Benedito Batistella","","","Rafard","","Zootecnia","12/1/2019","9/30/2022"
"Daniel Navarro da Rocha","André Antonio Pelegrine - Angela Maria Moraes - Camila Cristine Lopes - Carla Cristina Gomes Pinheiro - Cecília Buzatto Westin - Daniela Franco Bueno - Rubens Lincoln Santana Blazutti Marçal","Jheison Lopes dos Santos","Campinas","","","12/1/2019","7/31/2023"
"Luiz Henrique Pereira","Sergio dos Anjos Ferreira Pinto","Mateus Vidotti Ferreira, Ronan José Campos","Piracicaba","","Geociências","12/1/2019","8/31/2022"
"Clever Ricardo Chinaglia","Edgar Dutra Zanotto - Murilo Camuri Crovace","","São Carlos","","Engenharia de Materiais e Metalúrgica","12/1/2019","7/31/2021"
"Houari Cobas Gomez","Idágene Aparecida Cestari - Luciana Wasnievski da Silva de Luca Ramos - Marcelo Mazzetto - Mario Ricardo Gongora Rubio","","São Paulo","","Engenharia Biomédica","12/1/2019","5/31/2021"
"Jorge Augusto de Bonfim Gripp","Jorge Augusto de Bonfim Gripp","","São José dos Campos","","Engenharia Mecânica","12/1/2019","11/30/2021"
"Cristiane Maria Tibola","","","Piracicaba","","Agronomia","11/1/2019","10/31/2020"
"Luciano Armiliato","Leandro Vieira dos Santos","Marcelo Ventura Rubio","Campinas","","Engenharia Química","11/1/2019","10/31/2020"
"Cesar Antonio Francisco","","","Assis","","Geociências","11/1/2019","10/31/2021"
"Ursula Luana Rochetto Doubek","Domingos da Silva Leite - Edson Tomaz - Savio Souza Venancio Vianna","","Campinas","","Engenharia Química","11/1/2019","5/31/2021"
"Sergio Tsukahara","Marcos Daniel de Lima","Cesar de Almeida da Fonseca, Newton Pedro Rosa Vianna Junior","Santa Bárbara D'Oeste","","Engenharia Mecânica","11/1/2019","10/31/2021"
"Jacqueline de Oliveira","Ícaro Gusmão Pinto Vieira - Marise Cagnin Martins Parisi - Marta Helena Fillet Spoto","","Piracicaba","","Agronomia","11/1/2019","9/30/2020"
"Gustavo Gonçalves de Souza Salvati","","","Piracicaba","","Zootecnia","11/1/2019","9/30/2020"
"Sérgio Rodrigues Morbiolo","Rafael Luís Fonseca","","Campinas","","","11/1/2019","7/31/2020"
"Eduardo Torres Novais","Jose Jeronimo Rabelo Faria","","São José dos Campos","","Engenharia Aeroespacial","11/1/2019","7/31/2020"
"Roberto Fray da Silva","","Fernando Hattori","São Paulo","","Engenharia Mecânica","11/1/2019","7/31/2020"
"Luiz Carlos de Oliveira","","","Ribeirão Preto","","Física","11/1/2019","10/31/2022"
"Jorge Carlos Valverde Rebaza","Diego Minatel - Ricardo Miguel Puma Alvarez - Thiago de Paulo Faleiros - Vinícius Ferreira da Silva","","São Carlos","","Ciência da Computação","11/1/2019","10/31/2021"
"Adriana Ielo Derobio","","João Contart Neto","São Paulo","","Administração","11/1/2019","9/30/2020"
"Carla Carolina Munari","Ana Luiza Scarano Aguillera Forte - Ana Marisa Chudzinski-Tavassi - Denise Crispim Tavares Barbosa - Nayara Cristina Perez de Albuquerque","","Ribeirão Preto","","Farmacologia","11/1/2019","1/31/2022"
"Maico de Oliveira Pita","","","Cravinhos","","Genética","11/1/2019","7/31/2020"
"Sofia Nascimento dos Santos","Alexander Henning Ulrich - Emerson Soares Bernardes","","São Paulo","","Engenharia Nuclear","11/1/2019","10/31/2021"
"Hilton Vicente César","Jorge Elias Júnior - Paulo Mazzoncini de Azevedo Marques","","Ribeirão Preto","","Medicina","11/1/2019","7/31/2020"
"Tânia Petta","Franklin Behlau - Luiz Alberto Beraldo de Moraes","","Ribeirão Preto","","Química","11/1/2019","7/31/2020"
"Fabricio Theodoro Soares","Eduardo Fernandes Nunes - Ícaro Cavalcante Dourado","","Campinas","","Engenharia Agrícola","11/1/2019","10/31/2021"
"Marcio Marques da Silva","","","São Carlos","","Engenharia Mecânica","10/1/2019","10/31/2021"
"Lis Marie Monteiro","Gabriel Lima Barros de Araujo - Paulo Cesar Cotrim","Nádia Araci Bou-Chacra","Atibaia","","Farmácia","10/1/2019","10/31/2020"
"Ricardo Luis Araujo Dias","Luiz Claudio Di Stasi","","Botucatu","","Ciência e Tecnologia de Alimentos","10/1/2019","8/31/2020"
"Ricardo Filipe das Neves Lima Pereira","Mario Ricardo Gongora Rubio","","Cotia","","","10/1/2019","6/30/2020"
"Antonio Valerio Netto","Anna Carolina Muller Queiroz - Johnny Mascarenhas de Queirós - Romero Tori","","São Paulo","","","10/1/2019","1/31/2022"
"Marcelo Murville Camps","Clayton Heringer","","São Paulo","","Educação","10/1/2019","9/30/2021"
"Osnir Yoshime Watanabe","Angelo José Roncali da Silva - Carlos Eduardo Ambrósio - Dimas Tadeu Covas - Fabiana Fernandes Bressan - Felipe Perecin - Flávio Vieira Meirelles - Juliano Coelho da Silveira - Maristela Delgado Orellana - Simone Kashima Haddad","Robinson Antonio Martins de Oliveira, yeda fumie watanabe","Cravinhos","","Medicina Veterinária","10/1/2019","3/31/2022"
"Ricardo Guimarães","Pedro Jorge Saldanha Ramos - Silvio Pires Penteado","Anna Carolina de Oliveira Fonseca","São Paulo","","Medicina","10/1/2019","12/31/2020"
"Rafael Luís Fonseca","","","Campinas","","","10/1/2019","9/30/2021"
"Braulio Garcia Pereira Neto","Aline Peregrina Puga - Cristiano Alberto de Andrade","","São Paulo","","Agronomia","10/1/2019","8/31/2022"
"Morgana Regina Mendonça de Oliveira","Hermes Pretel","","Araraquara","","Odontologia","10/1/2019","9/30/2021"
"Claudio Renato Ribeiro de Mello Mazzola","","","São Paulo","","Engenharia de Produção","10/1/2019","6/30/2020"
"Leandro Agostini Do Amaral","Marcos Hortes Nisihara Chagas - Paula Costa Castro - Renata Pontin de Mattos Fortes","","São Carlos","","Ciência da Computação","10/1/2019","4/30/2022"
"Luis Carlos Pasquale Rosa","Beatriz Vidigal Xavier da Silveira Rosa - Cleyton Fernandes Ferrarini","Nilson Cristino da Cruz","Sorocaba","","Oceanografia","10/1/2019","3/31/2022"
"Gustavo Tadeu Zaniboni","","","São José dos Campos","","Ciência da Computação","10/1/2019","11/30/2020"
"Raphael Augusto Fagliari","Aline Chitero Bueno Fagliari - Anderson Luiz dos Santos Safre - Luis Augusto Gomes Rocha","Allan de Godoi Contessoto, Anderson Rici Amorim, Julio Cesar Momente, Leandro Bertini Lara Gonçalves, Ludwin Lope Cala, Marcelo Oliveira da Silva","São José do Rio Preto","","Engenharia Sanitária","10/1/2019","9/30/2021"
"Antonio Massato Makiyama","","","São Caetano do Sul","","Engenharia Biomédica","10/1/2019","9/30/2022"
"José Antonio Camacho Guerrero","Harley Francisco de Oliveira","","Ribeirão Preto","","Medicina","10/1/2019","9/30/2021"
"Vânia Santos Braz","Marlus Chorilli","","Araraquara","","Microbiologia","10/1/2019","8/31/2020"
"Flávio Pascoal Vieira","","","São Carlos","","Engenharia Biomédica","10/1/2019","9/30/2021"
"Lucas Madureira dos Anjos","André Luiz Martins Pignata - Luciana Oranges Cezarino - Rafael Madureira dos Anjos - Rodrigo Palucci Pantoni","","Ribeirão Preto","","Administração","10/1/2019","9/30/2021"
"Susan Dora Allendorf","Deise Carla Almeida Leite Dellova - Lívea Maria Gomes - Ricardo Luiz Moro de Sousa","","Sorocaba","","Medicina Veterinária","10/1/2019","7/31/2020"
"Eduardo Moré de Mattos","","Arthur Vrechi","Piracicaba","","Recursos Florestais e Engenharia Florestal","10/1/2019","1/31/2022"
"Leandro Yukio Mano Alves","Bruna Francielle Toneti - Fabiana Maria das Graças Corsi Zuelli - Tássia Ghissoni Pedroso","","Marília","","Ciência da Computação","10/1/2019","6/30/2020"
"Rodolfo Ribeiro da Silva","Bruno Cezar de Oliveira","","Sorocaba","","Ciência da Computação","10/1/2019","9/30/2021"
"Roberto Celestino Pereira","Carlos Humberto Porto Filho - Rodrigo Fontes Maia","","São Paulo","","Ciência da Computação","10/1/2019","9/30/2020"
"Adriel Bortolin","Cauê Ribeiro de Oliveira - Fauze Ahmad Aouada - José Manoel Marconcini - Luiz Henrique Capparelli Mattoso","","Rio Claro","","Engenharia de Materiais e Metalúrgica","9/1/2019","12/31/2020"
"Arthur de Miranda Neto","Andrea Martinesco Coelho Martins","","São Paulo","","","9/1/2019","11/30/2020"
"José Henrique Tertulino Rocha","Marcos Augusto Ananias Dassan - Mariana Vandromel Rodrigues","","Piracicaba","","Recursos Florestais e Engenharia Florestal","9/1/2019","7/31/2020"
"Paulo Cezar de Lucca","Almir Samuel Zanca - Hugo Bruno Correa Molinari - Lucia Mattiello","","Campinas","","Genética","9/1/2019","8/31/2021"
"Alessandro de Carvalho Lomônaco","","","Jambeiro","","Engenharia Mecânica","9/1/2019","8/31/2020"
"Cicero Cardoso Augusto","Araldo Gomes de Souza - Guilherme Valente de Souza","José Roberto da Silva","São Paulo","","","9/1/2019","5/31/2020"
"Jose Roberto Melo da Silva","Homero Santiago Maciel - Ruben Alexis Miranda Carrillo","Carla Simone Tafuri Marques, Emílio Cordeiro Maciel, Gilberto Oswaldo Ieno, Luís Roberto Ferreira, Michael Willian Roach","São Paulo","","","9/1/2019","8/31/2021"
"Isabela Rosier Olimpio Pereira","Luciano Avallone Bueno","","São Paulo","","Farmácia","9/1/2019","12/31/2020"
"Rodrigo Moreira Felgueira","Henrique Takachi Moriya - Soraia Katia Pereira Costa","","São Paulo","","Medicina","9/1/2019","1/31/2021"
"Murilo Abud Bichuette","","","São Carlos","","Engenharia de Materiais e Metalúrgica","9/1/2019","1/31/2021"
"Marcelo Alexandre Souza Miacci","","","São José dos Campos","","Geociências","9/1/2019","7/31/2020"
"Rhelvis de Campos Oliveira","Jean Vinícius Moreira","Marcos Spitzer","Mogi Guaçu","","Engenharia Química","9/1/2019","7/31/2020"
"Paulo Henrique da Silveira","","","São Paulo","","Engenharia Elétrica","9/1/2019","5/31/2020"
"Carlo Rondinoni","Antonio Adilton Oliveira Carneiro - Helio Rubens Machado - Helton Luiz Aparecido Defino - Oswaldo Baffa Filho - Renan Hiroshi Matsuda - Theo Zeferino Pavan","","Ribeirão Preto","","Medicina","9/1/2019","7/31/2020"
"Maria Paula Correia de Souza","","","São Paulo","","Museologia","9/1/2019","4/30/2022"
"Micheli Zaminhan Hassemer","Polyana Cristine Tizioto","Alexandre Wagner Silva Hilsdorf, Bruno Cavalheiro Araújo, Renata Guimarães Moreira Whitton","Campo Limpo Paulista","","Recursos Pesqueiros e Engenharia de Pesca","9/1/2019","7/31/2020"
"Adilson Liebsch","Felipe Halmenschlager Delvan - Lucas Zago - Sergio Aristides Castilho Venero - Thiago Trabach da Cunha","Caio César Machado e Silva, Carlos Felipe Rezende Facchini","São Carlos","","Ciência da Computação","9/1/2019","8/31/2021"
"Adriana Oliveira Manfiolli","Carolina Caliári Oliveira - Claudio Miguel da Costa Neto - Kamilla Swiech Antonietto - Kelen Cristina Ribeiro Malmegrim de Farias","","Ribeirão Preto","","Medicina","9/1/2019","5/31/2020"
"Leandro Soares Martins","Ériton Egidio Lisboa Valente - Fernanda Macitelli - Flávio Augusto Portela Santos - Luiz Gustavo Nussio","","Piracicaba","","Zootecnia","9/1/2019","5/31/2020"
"Valeria da Silva Santos","Mayanny Gomes da Silva","","Espírito Santo do Pinhal","","Ciência e Tecnologia de Alimentos","8/1/2019","7/31/2020"
"William Alberto Leonel Ferreira","","","São Carlos","","Química","8/1/2019","7/31/2021"
"Daniel Solferini de Carvalho","Fernando Henrique Mayworm de Araujo","João Andrade de Carvalho Junior","Lorena","","Engenharia Mecânica","8/1/2019","12/31/2021"
"Rafael Mira de Oliveira Libardi","Emanuel Carlos de Alcantara Valente - Lucas da Silva Assis","","Ribeirão Preto","","Ciência da Computação","8/1/2019","8/31/2020"
"Renato José Ferreira","","Eduardo Mayer Fagundes","Barueri","","Ciência da Computação","8/1/2019","4/30/2020"
"Felipe Iszlaji de Albuquerque","","","São Paulo","","Linguística","8/1/2019","4/30/2020"
"Evandro Drigo da Silva","Carlos Antonio França Sartori - Tarcísio Fernandes Leão - Viviane Cristine Silva","","São Paulo","","Engenharia Biomédica","8/1/2019","6/30/2020"
"Inajá Marchizeli Wenzel Rodrigues","Bruna Mariele de Almeida Guazzelli - Thiago Rodrigues de Castro","","Piracicaba","","Agronomia","8/1/2019","9/30/2020"
"Paula Renata Cerdeira Gomez","Conrado Leite de Vitor - Giuliano Leite de Vitor - Newton Bomeisel Cardoso","","São Paulo","","Engenharia Elétrica","8/1/2019","1/31/2022"
"Alexandre Leite Rosa","ANDRE RIYUITI HIRAKAWA - Luiz Henrique Leite Rosa","Rodrigo Tadeu de Oliveira Ladeira","São Paulo","","Engenharia Elétrica","8/1/2019","6/30/2020"
"Mardoqueu Martins da Costa","Adriana Pavinatto da Costa - Nivaldo Antonio Parizotto - Renata Marques de Melo Marinho","","São Carlos","","Engenharia de Materiais e Metalúrgica","8/1/2019","7/31/2020"
"Pedro Campos Assunção","","Arthur Roza Augusto, Saint Clair Henrique Nunes","São José dos Campos","","Engenharia Elétrica","8/1/2019","10/31/2021"
"Joao Marcos de Mattos Barguil","","","São Paulo","","Ciência da Computação","8/1/2019","7/31/2021"
"Daniela Spuri Bernardi","","","Ribeirão Preto","","Odontologia","8/1/2019","9/30/2020"
"Marcelo Aparecido Pelegrini","","","São Paulo","","Ciência da Computação","8/1/2019","3/31/2020"
